{
  "schemaVersion": 1,
  "id": "gpt-image2-105",
  "revision": "853783f4-36ef-4c43-8340-9e95daf7d5b8",
  "status": "published",
  "kind": "image",
  "title": "设计系统组件卡片集",
  "category": "design",
  "tags": [
    "界面设计",
    "外部收藏"
  ],
  "createdAt": "2026-09-21T02:55:26.855Z",
  "updatedAt": "2026-09-21T02:55:26.855Z",
  "prompt": {
    "text": "Generate a clean design system overview board for a fictional product language called LUMEN UI, arranged as a square component gallery on a 2048x2048 canvas. Use a neutral palette of ivory, charcoal, muted blue, sage, and coral accents. The composition should be an orderly grid of cards showing buttons, input fields, badges, toggles, tabs, avatars, alerts, and pricing cards. Include crisp typography, even spacing, subtle shadows, and exact alignment as if exported from a professional design tool. Add labeled sections with the in-image text \"LUMEN UI\", \"Buttons\", \"Inputs\", \"Status\", \"Cards\", and \"Type Scale\". Include sample button labels \"Primary\", \"Secondary\", and \"Danger\"; badge labels \"Success\", \"Pending\", and \"Error\"; and typography specimens \"Display 48\", \"Heading 24\", and \"Body 16\". Ensure the board feels systematic, editorial, and highly legible, with clean hierarchy, correct labels, and polished component consistency suitable for a design systems gallery.",
    "language": "en"
  },
  "generation": {
    "platform": "",
    "modelLabel": "未记录模型",
    "modelId": null,
    "modelEvidence": "unknown",
    "generatedAt": null,
    "parameters": {}
  },
  "outputs": [
    {
      "id": "result-1",
      "mediaType": "image",
      "alt": "设计系统组件卡片集，源图库所展示的生成结果",
      "original": {
        "key": "published/gpt-image2-105/2f7ad8a533a124d657c4687024226f10.png",
        "mimeType": "image/png",
        "bytes": 511121,
        "sha256": "2f7ad8a533a124d657c4687024226f10c59660d6b8d2d5fa7afaf2b992913d0b"
      },
      "thumbnail": {
        "key": "published/gpt-image2-105/71dc3c59c99e5edf5db23d887289768a.webp",
        "mimeType": "image/webp",
        "bytes": 29480,
        "sha256": "71dc3c59c99e5edf5db23d887289768a369d26a3888469af9eca83c879adaaca"
      },
      "preview": {
        "key": "published/gpt-image2-105/8c930a22f0713df47454fb8f55c93cad.webp",
        "mimeType": "image/webp",
        "bytes": 59866,
        "sha256": "8c930a22f0713df47454fb8f55c93cad95210de187302cd72dbfe35b6786df8f"
      },
      "width": 1024,
      "height": 1024,
      "durationSeconds": null,
      "postProcessing": "unknown"
    }
  ],
  "coverOutputId": "result-1",
  "source": {
    "type": "collected",
    "author": "Wuyoscar（整理）",
    "url": "https://github.com/wuyoscar/GPT-Image2-Skill/blob/05cb1130bba29e0fc028220376280a2e934a8041/skills/gpt-image/references/gallery-ui-ux-mockups.md",
    "contributor": "wuyoscar/GPT-Image2-Skill"
  },
  "rights": {
    "prompt": "unspecified",
    "media": "unspecified",
    "notes": "收录自 GPT-Image2-Skill（上游提交 05cb1130bba29e0fc028220376280a2e934a8041，案例 No. 105）。上游仓库声明 MIT License，并要求保留图库作者和来源标注；部分案例另有第三方作者/来源，原始素材的单独授权未核实。仓库许可全文见本站项目 docs/third-party/GPT-Image2-Skill-LICENSE.txt。源图库：https://github.com/wuyoscar/GPT-Image2-Skill/blob/05cb1130bba29e0fc028220376280a2e934a8041/skills/gpt-image/references/gallery-ui-ux-mockups.md"
  }
}
