{
  "schemaVersion": 1,
  "id": "gpt-image2-140",
  "revision": "06106cc6-4d7e-4cf4-9e1a-ddcf5c72bf96",
  "status": "published",
  "kind": "image",
  "title": "深红与赭色抽象色域",
  "category": "design",
  "tags": [
    "绘画艺术",
    "外部收藏"
  ],
  "createdAt": "2026-09-21T02:54:50.855Z",
  "updatedAt": "2026-09-21T02:54:50.855Z",
  "prompt": {
    "text": "A large-scale abstract painting in the lineage of mid-century Color Field expressionism. The composition consists of three stacked, soft-edged rectangular forms that appear to float against a darker background. The top rectangle is a deep 'Oxblood Red', the middle is a vibrating 'Burnt Orange', and the bottom is a dusty 'Ochre'. The edges of the shapes are hazy and feathered, allowing the colors to bleed into one another and create a sense of profound depth. The texture of the canvas is subtly visible through the thin, layered washes of pigment. There is no representational subject matter; the focus is entirely on the emotional resonance of the color and the monumental scale. The lighting is soft and ambient, making the colors seem to glow from within the canvas. The mood is spiritual, somber, and deeply immersive.",
    "language": "en"
  },
  "generation": {
    "platform": "",
    "modelLabel": "未记录模型",
    "modelId": null,
    "modelEvidence": "unknown",
    "generatedAt": null,
    "parameters": {}
  },
  "outputs": [
    {
      "id": "result-1",
      "mediaType": "image",
      "alt": "深红与赭色抽象色域，源图库所展示的生成结果",
      "original": {
        "key": "published/gpt-image2-140/36875474f029b2c470fc85e86843fbdd.png",
        "mimeType": "image/png",
        "bytes": 11330836,
        "sha256": "36875474f029b2c470fc85e86843fbdd273a812f9a686a491dbcff94401d8ffb"
      },
      "thumbnail": {
        "key": "published/gpt-image2-140/ee755751c6af03c85d34e5c0656ae991.webp",
        "mimeType": "image/webp",
        "bytes": 6722,
        "sha256": "ee755751c6af03c85d34e5c0656ae991fb4e8d2c2348fafb3ca476256d84018a"
      },
      "preview": {
        "key": "published/gpt-image2-140/945f4e4351890215986868fb165cc8b1.webp",
        "mimeType": "image/webp",
        "bytes": 52132,
        "sha256": "945f4e4351890215986868fb165cc8b139b6a57487ac9242264e268d9e488703"
      },
      "width": 2160,
      "height": 3840,
      "durationSeconds": null,
      "postProcessing": "unknown"
    }
  ],
  "coverOutputId": "result-1",
  "source": {
    "type": "collected",
    "author": "Wuyoscar（整理）",
    "url": "https://github.com/wuyoscar/GPT-Image2-Skill/blob/05cb1130bba29e0fc028220376280a2e934a8041/skills/gpt-image/references/gallery-fine-art-painting.md",
    "contributor": "wuyoscar/GPT-Image2-Skill"
  },
  "rights": {
    "prompt": "unspecified",
    "media": "unspecified",
    "notes": "收录自 GPT-Image2-Skill（上游提交 05cb1130bba29e0fc028220376280a2e934a8041，案例 No. 140）。上游仓库声明 MIT License，并要求保留图库作者和来源标注；部分案例另有第三方作者/来源，原始素材的单独授权未核实。仓库许可全文见本站项目 docs/third-party/GPT-Image2-Skill-LICENSE.txt。源图库：https://github.com/wuyoscar/GPT-Image2-Skill/blob/05cb1130bba29e0fc028220376280a2e934a8041/skills/gpt-image/references/gallery-fine-art-painting.md"
  }
}
