{
  "schemaVersion": 1,
  "id": "gpt-image2-097",
  "revision": "ab7ef337-68b8-4c21-a467-749788e86aca",
  "status": "published",
  "kind": "image",
  "title": "自动咖啡机信息图",
  "category": "other",
  "tags": [
    "官方示例",
    "外部收藏"
  ],
  "createdAt": "2026-09-21T02:55:35.855Z",
  "updatedAt": "2026-09-21T02:55:35.855Z",
  "prompt": {
    "text": "Create a detailed Infographic of the functioning and flow of an automatic coffee machine like a Jura.\nFrom bean basket, to grinding, to scale, water tank, boiler, etc.\nI'd like to understand technically and visually the flow.",
    "language": "en"
  },
  "generation": {
    "platform": "",
    "modelLabel": "未记录模型",
    "modelId": null,
    "modelEvidence": "unknown",
    "generatedAt": null,
    "parameters": {}
  },
  "outputs": [
    {
      "id": "result-1",
      "mediaType": "image",
      "alt": "自动咖啡机信息图，源图库所展示的生成结果",
      "original": {
        "key": "published/gpt-image2-097/1ad1f8cddf8bf915436b0ff5117f5acc.png",
        "mimeType": "image/png",
        "bytes": 1623473,
        "sha256": "1ad1f8cddf8bf915436b0ff5117f5accc8e6535daedc8767f76880fe834a7ba3"
      },
      "thumbnail": {
        "key": "published/gpt-image2-097/9c10abc834db156aabecce8b8f75bf54.webp",
        "mimeType": "image/webp",
        "bytes": 52160,
        "sha256": "9c10abc834db156aabecce8b8f75bf54d8b9bf61482d58573ab03473505b2571"
      },
      "preview": {
        "key": "published/gpt-image2-097/73902183520639800c6fbd8a47eff51a.webp",
        "mimeType": "image/webp",
        "bytes": 220898,
        "sha256": "73902183520639800c6fbd8a47eff51ac37f90dd2470ec1c05ff30050ebe6fa7"
      },
      "width": 1024,
      "height": 1536,
      "durationSeconds": null,
      "postProcessing": "unknown"
    }
  ],
  "coverOutputId": "result-1",
  "source": {
    "type": "collected",
    "author": "OpenAI",
    "url": "https://github.com/openai/openai-cookbook/blob/main/examples/multimodal/image-gen-models-prompting-guide.ipynb",
    "contributor": "wuyoscar/GPT-Image2-Skill"
  },
  "rights": {
    "prompt": "unspecified",
    "media": "unspecified",
    "notes": "收录自 GPT-Image2-Skill（上游提交 05cb1130bba29e0fc028220376280a2e934a8041，案例 No. 97）。上游仓库声明 MIT License，并要求保留图库作者和来源标注；部分案例另有第三方作者/来源，原始素材的单独授权未核实。仓库许可全文见本站项目 docs/third-party/GPT-Image2-Skill-LICENSE.txt。源图库：https://github.com/wuyoscar/GPT-Image2-Skill/blob/05cb1130bba29e0fc028220376280a2e934a8041/skills/gpt-image/references/gallery-official-openai-cookbook-examples.md"
  }
}
