{
  "schemaVersion": 1,
  "id": "gpt-image2-046",
  "revision": "d4818343-2de1-4a95-b717-15c4b742e0d8",
  "status": "published",
  "kind": "image",
  "title": "复古阿马尔菲海岸旅游海报",
  "category": "design",
  "tags": [
    "插画",
    "外部收藏"
  ],
  "createdAt": "2026-09-21T02:56:28.855Z",
  "updatedAt": "2026-09-21T02:56:28.855Z",
  "prompt": {
    "text": "现代铅笔插画风格的复古旅游海报插画，主题是意大利阿马尔菲海岸，展示全景沿海悬崖公路场景，经典1960年代白色汽车沿着弯曲的海边道路行驶，深蓝色地中海海面上有小帆船，色彩丰富的粉彩色山丘村落，明亮蓝天带柔和云朵，前景框架由鲜艳黄柠檬的柠檬树枝构成，温暖的夏日阳光，鲜明艳丽的色彩，复古1950年代旅游海报风格，电影级构图，高细节，丝网印刷质感，图形插画。手绘风格，采用松散笔触和清晰轮廓。高对比色彩调色板，保持背景与元素间的色彩和谐。现代且装饰性的美学。",
    "language": "mixed"
  },
  "generation": {
    "platform": "",
    "modelLabel": "未记录模型",
    "modelId": null,
    "modelEvidence": "unknown",
    "generatedAt": null,
    "parameters": {}
  },
  "outputs": [
    {
      "id": "result-1",
      "mediaType": "image",
      "alt": "复古阿马尔菲海岸旅游海报，源图库所展示的生成结果",
      "original": {
        "key": "published/gpt-image2-046/b30991099a3b90194cfb0c74a7ed0d61.png",
        "mimeType": "image/png",
        "bytes": 3360876,
        "sha256": "b30991099a3b90194cfb0c74a7ed0d61eb6de0a84b5c94d3e41d7d11406d3a99"
      },
      "thumbnail": {
        "key": "published/gpt-image2-046/7b9ef8643b762d13aae8bf2876a712b8.webp",
        "mimeType": "image/webp",
        "bytes": 70502,
        "sha256": "7b9ef8643b762d13aae8bf2876a712b8f3a9d37520f8af81fdefb63da6dd4c33"
      },
      "preview": {
        "key": "published/gpt-image2-046/b51b4010147964abdfcb495271b9dede.webp",
        "mimeType": "image/webp",
        "bytes": 409216,
        "sha256": "b51b4010147964abdfcb495271b9dede56b4e6b416b69260d58c5da559536922"
      },
      "width": 1024,
      "height": 1536,
      "durationSeconds": null,
      "postProcessing": "unknown"
    }
  ],
  "coverOutputId": "result-1",
  "source": {
    "type": "collected",
    "author": "@WolfRiccardo",
    "url": "https://x.com/WolfRiccardo",
    "contributor": "wuyoscar/GPT-Image2-Skill"
  },
  "rights": {
    "prompt": "unspecified",
    "media": "unspecified",
    "notes": "收录自 GPT-Image2-Skill（上游提交 05cb1130bba29e0fc028220376280a2e934a8041，案例 No. 46）。上游仓库声明 MIT License，并要求保留图库作者和来源标注；部分案例另有第三方作者/来源，原始素材的单独授权未核实。仓库许可全文见本站项目 docs/third-party/GPT-Image2-Skill-LICENSE.txt。源图库：https://github.com/wuyoscar/GPT-Image2-Skill/blob/05cb1130bba29e0fc028220376280a2e934a8041/skills/gpt-image/references/gallery-illustration.md"
  }
}
